chunk,phrase_type,word_order
advmod root nsubj det obj,adverbial_clause,pso
cc conj,unknown_chunk,v
case obl obj nsubj ref nsubj obl det pobj,prepositional_phrase,ovs
acl:relcl ccomp,complement_clause,v
voc punct advmod appos punct root advmod,adverbial_clause,p
punct advcl det nsubj ccomp acomp,subordinate_clause,sv
punct,unknown_chunk,unknown
cc nsubj root advmod advmod advmod,adverbial_clause,sp
cc nsubj root det iobj,noun_phrase,spo
nsubj root advmod advmod xcomp punct mark nsubj aux advmod advcl,subordinate_clause,sp
mark nsubj iobj obj,subordinate_clause,vso
punct cc,unknown_chunk,v
conj iobj,unknown_chunk,v
case advmod amod amod obj,prepositional_phrase,v
case det amod nmod cc conj iobj det obj appos,prepositional_phrase,v
cc conj advmod det amod obj appos,adverbial_clause,v
cc conj iobj,unknown_chunk,v
case nmod obl mark nsubj aux,prepositional_phrase,osv
ccomp det obj,noun_phrase,v
mark nsubj advmod,subordinate_clause,sv
ccomp cc nsubj aux aux,complement_clause,sv
conj,unknown_chunk,unknown
cc det nsubj root,noun_phrase,sp
case obl cc conj obj compound det compound,prepositional_phrase,v
conj cc det det conj,noun_phrase,unknown
advmod nsubj obj root,adverbial_clause,sop
punct ccomp nsubj csubj,complement_clause,s
punct nsubj,unknown_chunk,vs
conj advmod advmod punct ccomp nsubj obj advmod neg xcomp ccomp,adverbial_clause,sov
punct advcl nsubj,subordinate_clause,vs
ccomp advmod xcomp obj,adverbial_clause,v
punct advcl nsubj advmod obj advmod,subordinate_clause,vso
ccomp,complement_clause,v
advmod root nsubj,adverbial_clause,ps
case det amod obl,prepositional_phrase,v
case det obl nsubj advmod acl:relcl obj,prepositional_phrase,osv
cc conj nsubj advmod,adverbial_clause,vs
cc conj advmod,adverbial_clause,v
case det obl punct advmod parataxis nsubj,prepositional_phrase,ovs
cc conj parataxis advmod obj nsubj aux,adverbial_clause,sv
acl:relcl obj,unknown_chunk,v
punct nsubj advmod,adverbial_clause,vs
case obl aux,prepositional_phrase,sv
acl:relcl punct cc nsubj parataxis advmod cc parataxis case obl case det amod obl mark nsubj advmod advmod,prepositional_phrase,sov
ccomp case det obl,prepositional_phrase,v
case obl X,prepositional_phrase,v
advmod nsubj relcl case det nmod obj root,prepositional_phrase,sp
mark det nsubj ccomp xcomp,subordinate_clause,sv
case det nmod advmod obj advmod advmod amod nsubj aux,prepositional_phrase,osv
conj cc advmod advmod advmod obj aux,adverbial_clause,v
conj advmod parataxis attr nsubj parataxis det amod obj,adverbial_clause,svo
mark nsubj parataxis obj nsubj mark advmod det attr appos,subordinate_clause,sov
ccomp mark nsubj advmod xcomp,subordinate_clause,sv
ccomp case nmod det det obl xcomp aux nsubj parataxis advmod,prepositional_phrase,osv
case det obl det nmod X X X X X,prepositional_phrase,unknown
advmod root obj amod obj,adverbial_clause,p
punct cc nsubj ref,unknown_chunk,vs
case det obl acl:relcl ref,prepositional_phrase,v
conj det iobj amod obj,noun_phrase,v
cc conj punct mark nsubj advmod advcl,subordinate_clause,sv
mark nsubj advmod,subordinate_clause,vs
ccomp obl case det obl obl case amod obl aux xcom aux,prepositional_phrase,v
root nsubj advmod advcl obl det,subordinate_clause,pso
case conj amod nsubj obl advcl conj case acl obl amod,prepositional_phrase,sov
case conj conj amod X X X,prepositional_phrase,v
advmod root nsubj obl amod pobj,adverbial_clause,pso
cc conj advmod obl amod pobj,adverbial_clause,v
mark nsubj advcl advmod obl pobj,subordinate_clause,svo
acl:relcl nsubj acl det obj obl det pobj obl det pobj,noun_phrase,svo
cc obj det nsubj advmod advmod root,adverbial_clause,sp
case det compound obl mark nsubj advcl,prepositional_phrase,ovs
mark ccomp det cop obj nsubj det nmod appos aux xcomp,subordinate_clause,sv
cc conj poss amod obj X X,noun_phrase,unknown
cc advmod root nsubj iobj det amod obj obj nsubj,adverbial_clause,pso
acl:relcl cc,unknown_chunk,v
conj iobj obl pobj,unknown_chunk,v
cc conj advmod,adverbial_clause,v
case det obl,prepositional_phrase,v
ccomp nsubj obj iobj,complement_clause,vso
ccomp det obl,noun_phrase,v
cc iobj conj obj nsubj obj advmod xcomp,adverbial_clause,osv
ccomp,complement_clause,v
nsubj root,main_clause,sp
case det obl mark nsubj iobj ccomp,prepositional_phrase,osv
cc conj nsubj cop advmod,adverbial_clause,sv
case mark nsubj neg advmod aux obl,prepositional_phrase,svo
mark nsubj advmod advcl,subordinate_clause,s
mark nsubj aux amod nmod:poss obl acl det obj,subordinate_clause,sov
cc conj mark obj aux root X X,subordinate_clause,p
advmod root nsubj det obj,adverbial_clause,pso
amod voc punct root nsubj obj det nsubj cop,noun_phrase,pso
acl:relcl advmod acl case det amod pobj nsubj advmod nsubj neg advmod,prepositional_phrase,sv
conj obj,unknown_chunk,v
punct advmod nsubj,adverbial_clause,vs
conj attr det nmod:poss compound appos aux advmod,adverbial_clause,v
conj obl nmod:poss pobj cc nsubj acl:relcl obl case nsubj cc conj advmod obj aux acl,prepositional_phrase,osv
punct punct det nmod:poss compound nsubj,noun_phrase,vs
conj obl det amod nmod:poss amod obj,noun_phrase,v
advcl advmod punct root nsubj,subordinate_clause,ps
punct ccomp nsubj ccomp det attr advmod,adverbial_clause,sv
punct cc obl det pobj conj nsubj acomp acomp acomp xcomp,noun_phrase,ovs
advmod nsubj root amod obl nsubj,adverbial_clause,spo
conj advmod xcomp,adverbial_clause,v
case det amod obl,prepositional_phrase,v
mark det nsubj advmod advcl obj nsubj obj,subordinate_clause,vso
acl:relcl mark nsubj advcl advmod advmod xcomp X X X,subordinate_clause,sv
advmod root det nummod nsubj obl pobj cc advmod,adverbial_clause,pso
conj nsubj det appos obl det pobj X,noun_phrase,vso
advmod root aux det nsubj advmod,adverbial_clause,ps
cc conj,unknown_chunk,v
mark det nsubj nsubj,subordinate_clause,vs
case det obl acl:relcl obj parataxis xcomp X X X,prepositional_phrase,v
mark det nsubj root obl,subordinate_clause,spo
case,prepositional_phrase,unknown
voc amod nsubj root acomp advmod X,adverbial_clause,sp
advmod root nsubj,adverbial_clause,ps
advmod det obj punct root nsubj,adverbial_clause,ops
punct ccomp nsubj,complement_clause,vs
ccomp case det obl,prepositional_phrase,v
punct ref aux acl det obj,noun_phrase,v
case det amod obl punct,prepositional_phrase,v
cc det det nsubj conj obj advmod,adverbial_clause,svo
case det obl nsubj advcl,prepositional_phrase,osv
advmod punct root nsubj,adverbial_clause,ps
punct ccomp obj xcomp attr advmod,adverbial_clause,v
punct conj nsubj,unknown_chunk,vs
punct advmod,adverbial_clause,v
amod voc root nsubj advmod,adverbial_clause,ps
ccomp case obl advmod xcomp advcl det nsubj advcl amod obj xcomp nsubj,prepositional_phrase,vso
conj acomp cc conj cc advmod obj,adverbial_clause,v
case obl nsubj,prepositional_phrase,vos
conj X X X X X,unknown_chunk,unknown
discourse root det nsubj mark advmod case amod obl ccomp det nsubj acomp,prepositional_phrase,pso
mark advmod det nsubj advmod acomp conj mark nsubj advmod aux,subordinate_clause,sv
ccomp X X X,complement_clause,v
case det obl aux nsubj advmod root,prepositional_phrase,osp
ccomp nsubj attr ccomp nsubj,complement_clause,sv
acl:relcl aux det obj,noun_phrase,v
case det amod obl obl case det amod nsubj acl:relcl aux X,prepositional_phrase,osv
amod vocative root det nsubj,noun_phrase,ps
case det obl advmod parataxis obj,prepositional_phrase,v
mark iobj nsubj,subordinate_clause,os
ccomp case obj parataxis obj nsubj,prepositional_phrase,ovs
ccomp parataxis nsubj nsubj,complement_clause,vs
ccomp det det amod attr,noun_phrase,v
case det obl,prepositional_phrase,v
cc conj det attr amod cc conj attr,noun_phrase,v
cc case det obl det nmod compound advmod amod parataxis,prepositional_phrase,v
mark nsubj ref case obl,prepositional_phrase,sv
acl:relcl case obl,prepositional_phrase,v
mark nsubj ccomp case det obl X X X X X X,prepositional_phrase,sov
cc advmod root obl det obl,adverbial_clause,p
mark xcomp advmod advmod advmod obj obl pobj,subordinate_clause,v
advmod mark nsubj advcl xcomp,subordinate_clause,sv
case nmod obj mark root nsubj advmod,prepositional_phrase,ops
mark nsubj det appos det amod obj aux,subordinate_clause,sov
ccomp case det amod nmod amod pobj advmod mark nsubj iobj advmod xcomp,prepositional_phrase,os
ccomp case det pobj nsubj advmod aux,prepositional_phrase,osv
conj X,unknown_chunk,v
cc det nsubj det nsubj advmod nsubj det advmod acomp aux,adverbial_clause,sv
ccomp punct aux nsubj obj det obj nmod:poss aux root,noun_phrase,sop
mark det nsubj aux advcl punct cc det nsubj case det nmod det obj conj case det nmod punct,prepositional_phrase,sov
cc det nsubj root advmod case det amod obl cc conj det obj case advmod cc conj amod obj,prepositional_phrase,spo
punct ccomp nsubj advmod obj advcl,subordinate_clause,sov
mark xcomp,subordinate_clause,unknown
advmod root obj det nsubj advmod xcomp,adverbial_clause,pos
cc conj,unknown_chunk,v
amod vocative advmod aux nsubj root det amod obj xcomp,adverbial_clause,spo
mark nsubj,subordinate_clause,vs
cc conj ref obl det case obj aux ccomp mark xcomp X X,prepositional_phrase,v
advmod root nsubj advmod,adverbial_clause,ps
case xcomp advmod,prepositional_phrase,v
mark nsubj advmod obl,subordinate_clause,vso
case ccomp punct,prepositional_phrase,v
mark nsubj neg advmod obl,subordinate_clause,vso
case advcl aux,prepositional_phrase,v
punct mark nsubj advmod advcl,subordinate_clause,vs
mark det nsubj obl det amod case advmod obj ccomp aux,prepositional_phrase,sov
mark nsubj advcl,subordinate_clause,sv
obj iobj advmod root xcomp xcomp,adverbial_clause,p
punct mark nsubj obj neg xcomp advcl,subordinate_clause,sov
punct nsubj parataxis advmod amod obj advmod,adverbial_clause,svo
case xcomp,prepositional_phrase,v
voc root det obj xcomp nsubj,noun_phrase,pos
cc conj,unknown_chunk,v
ccomp case acomp,prepositional_phrase,v
mark xcomp mark obj obj iobj nsubj aux,subordinate_clause,osv
acl:relcl mark det obj,subordinate_clause,v
mark xcomp case det amod obl,prepositional_phrase,v
case det amod obl nsubj advmod advmod aux,prepositional_phrase,osv
acl:relcl X X X,unknown_chunk,v
advmod root det nsubj,adverbial_clause,ps
case obl advcl,prepositional_phrase,v
cc conj,unknown_chunk,v
vocative root acomp,main_clause,p
mark advmod aux advcl nsubj case xcomp mark xcomp X X,prepositional_phrase,sv
advmod root nsubj advmod obl punct det obj nsubj,adverbial_clause,pso
conj cc advmod obj poss acl,adverbial_clause,v
conj,unknown_chunk,v
advmod voc punct root nsubj,adverbial_clause,ps
punct nsubj,unknown_chunk,vs
ccomp expl acomp,complement_clause,v
mark xcomp punct advcl obl pobj aux nsubj,subordinate_clause,ovs
ccomp nsubj,complement_clause,vs
conj aux obj det obl det amod nmod,noun_phrase,v
punct ref obj advmod,adverbial_clause,v
ccomp aux,complement_clause,v
vocative punct root det nsubj,noun_phrase,ps
punct nmod:poss obj ccomp nsubj advmod obj,adverbial_clause,osv
mark xcomp mark det amod obj obl det pobj,subordinate_clause,v
mark obj mark advcl,subordinate_clause,v
mark det obj ref nsubj aux,subordinate_clause,osv
acl:relcl punct mark nsubj ref obl pobj aux ccomp,subordinate_clause,sov
advmod nsubj root mark nsubj neg xcomp,subordinate_clause,sp
ccomp punct,complement_clause,v
mark nsubj attr advcl nsubj obj det,subordinate_clause,svo
mark obl xcomp,subordinate_clause,v
ccomp mark det nsubj,subordinate_clause,vs
case xcomp advcl,prepositional_phrase,unknown
advmod advmod root nsubj iobj compound xcomp,adverbial_clause,pso
mark nsubj obj,subordinate_clause,vso
ccomp ref nsubj aux,complement_clause,sv
mark obj acl:relcl,subordinate_clause,v
voc punct root nsubj,main_clause,ps
punct advmod,adverbial_clause,v
ccomp det nsubj advcl nsubj iobj advcl,subordinate_clause,sov
punct advcl nsubj,subordinate_clause,vs
ccomp advmod xcomp obj,adverbial_clause,v
mark xcomp,subordinate_clause,v
nsubj aux obj advmod,adverbial_clause,sov
ccomp punct root det nsubj,noun_phrase,ps
cc conj obj,unknown_chunk,v
case det obl cc conj advmod,prepositional_phrase,v
case det obl,prepositional_phrase,unknown
cc det nsubj case det nmod root advmod,prepositional_phrase,sp
mark xcomp,subordinate_clause,v
mark det nsubj case det nmod advcl,prepositional_phrase,sv
case obj xcompl,prepositional_phrase,v
advmod root det nsubj cc det conj punct det amod obj obl det pobj,adverbial_clause,pso
conj,unknown_chunk,unknown
cc det nsubj root,noun_phrase,sp
case det obl,prepositional_phrase,v
punct,unknown_chunk,unknown
cc mark advmod mark nsubj obj advcl advmod,subordinate_clause,sov
conj nsubj det obj compound:prt xcomp,noun_phrase,so
cc root obl pobj det amod pobj nsubj obl pobj acl X,noun_phrase,pos
root obj punct parataxis,main_clause,p
case obl advmod obl,prepositional_phrase,v
punct advcl nsubj aux neg,subordinate_clause,sv
ccomp case amod obl,prepositional_phrase,v
punct nsubj aux parataxis det obj xcomp,noun_phrase,svo
punct advcl nsubj advmod advmod,subordinate_clause,vs
ccomp aux,complement_clause,v
case det obl root det nsubj compound:prt,prepositional_phrase,ops
case det obl cc case obl det amod conj case nmod cc case conj,prepositional_phrase,unknown
cc mark advmod mark nsubj advcl,subordinate_clause,sv
case det obl,prepositional_phrase,v
cc det nsubj obj conj xcomp advmod root nsubj compound:prt,adverbial_clause,sop
mark xcomp X,subordinate_clause,v
root parataxis amod voc det appos,noun_phrase,p
cc conj obj advmod X X X,adverbial_clause,v
cc det nsubj root obl,noun_phrase,spo
case,prepositional_phrase,v
voc punct root advmod det obj,adverbial_clause,p
punct advcl mark nsubj advmod aux ccomp,subordinate_clause,sv
punct det obj compound:prt aux xcomp,noun_phrase,v
case det obl punct advmod det det obj,prepositional_phrase,v
case det nmod aux advmod conj mark nsubj obj neg obj,prepositional_phrase,sov
ccomp,complement_clause,unknown
voc root nsubj nsubj,main_clause,ps
ccomp neg attr advmod det nsubj nsubj,adverbial_clause,vs
conj attr cc neg attr,unknown_chunk,v
cc case det obj det nmod,prepositional_phrase,v
mark conj advmod conj nsubj nmod:poss obj obl pobj advcl nsubj advmod,subordinate_clause,sov
ccomp xcomp X X X X X X,infinitive_clause,v
mark root nsubj det obj,subordinate_clause,pso
case det obl,prepositional_phrase,v
cc conj obj advmod advmod advmod advmod,adverbial_clause,v
mark nsubj neg advcl cc,subordinate_clause,sv
conj det obj,noun_phrase,v
cc conj obj advmod,adverbial_clause,v
cc conj obj obl case cc conj obl det obj X,prepositional_phrase,v
vocative advmod root nsubj acomp,adverbial_clause,ps
mark nsubj advmod ccomp X,subordinate_clause,sv
advmod root iobj neg advmod det obj punct obj acl nsubj neg,adverbial_clause,pos
amod voc punct root det nsubj,noun_phrase,ps
punct nsubj aux ccomp iobj obj advmod xcomp,adverbial_clause,sov
mark nsubj iobj det obj aux advcl,subordinate_clause,sov
advmod root nsubj det det obj advmod,adverbial_clause,pso
mark det nsubj acl,subordinate_clause,sv
case det amod amod obl cc conj advmod advmod,prepositional_phrase,v
case obl,prepositional_phrase,v
cc mark nsubj advmod advcl,subordinate_clause,sv
punct nsubj root det obj,noun_phrase,spo
cc nmod:poss obj,unknown_chunk,v
cc conj mark nsubj advmod,subordinate_clause,s
ccomp punct cc nsubj conj det attr obl pobj,noun_phrase,svo
nsubj root cc conj,main_clause,sp
voc punct nsubj root advmod,adverbial_clause,sp
punct nsubj conj advmod,adverbial_clause,sv
cc conj advmod,adverbial_clause,v
cc conj det obj,noun_phrase,v
discourse vocative punct expl root det nsubj acomp advmod advmod advmod,adverbial_clause,ps
cc mark nsubj obj advcl nsubj root obj,subordinate_clause,sop
cc conj X,unknown_chunk,v
voc punct advmod parataxis obl,adverbial_clause,v
punct nsubj ccomp iobj,complement_clause,svo
punct obl nmod:poss obj punct root nsubj,main_clause,ops
punct advmod,adverbial_clause,v
ccomp nsubj obj advmod xcomp,adverbial_clause,sov
punct amod obl,noun_phrase,sv
acl:relcl advmod acl,adverbial_clause,v
advmod advmod root nsubj det amod attr nsubj advmod,adverbial_clause,ps
acl:relcl punct cc nsubj advmod det amod obj xcomp conj nsubj conj xcomp xcomp,adverbial_clause,sov
punct advcl advmod advcl nsubj,subordinate_clause,vs
cc nsubj obj advmod conj punct nsubj root obj xcomp obl,adverbial_clause,sop
case,prepositional_phrase,v
case amod mark nsubj advcl cop advmod root,prepositional_phrase,sp
case det obl case det nmod mark nsubj advcl advmod obj advmod acl X,prepositional_phrase,osv
cc advmod advmod root acomp,adverbial_clause,p
cc conj nmod:poss attr,unknown_chunk,v
punct advmod nsubj advmod parataxis,adverbial_clause,vs
mark nmod:poss nsubj,subordinate_clause,vs
ccomp det amod obj cop obl det pobj,noun_phrase,v
cc nsubj root,main_clause,sp
punct nsubj parataxis obj advmod xcomp,adverbial_clause,svo
mark nsubj obj ccomp,subordinate_clause,sov
punct mark amod nsubj aux iobj,subordinate_clause,svo
case amod nmod advcl,prepositional_phrase,unknown
advmod root obj det nsubj case det obl cc conj,prepositional_phrase,pos
compound vocative iobj compound iobj det appos,noun_phrase,v
case obl obj,prepositional_phrase,v
case det obl advmod advmod aux iobj det amod nsubj parataxis det amod nsubj,prepositional_phrase,osv
case obl acl nsubj parataxis advmod,prepositional_phrase,os
case det obl nsubj parataxis,prepositional_phrase,vos
case amod det obl,prepositional_phrase,v
cc root nsubj advmod,adverbial_clause,ps
case det amod obl nsubj aux,prepositional_phrase,osv
ccomp case det obl cc,prepositional_phrase,v
conj det det xcomp,noun_phrase,v
case det obl xcomp X X X X X,prepositional_phrase,v
cc mark advmod mark nsubj det advcl,subordinate_clause,sv
punct advmod root nsubj obj advmod cc conj iobj obj advmod advmod nsubj advcl aux,subordinate_clause,pso
cc root amod attr,noun_phrase,p
cc conj obj nsubj advmod aux acl,adverbial_clause,osv
punct mark,subordinate_clause,v
mark advcl expl nsubj ccomp,subordinate_clause,sv
cc advmod nsubj advmod ccomp aux,adverbial_clause,sv
mark nsubj root obj advmod,subordinate_clause,spo
ccomp advmod obj nsubj,adverbial_clause,vos
acl:relcl,unknown_chunk,v
advmod root det nsubj,adverbial_clause,ps
case det obl case det nmod,prepositional_phrase,unknown
vocative compound punct nsubj root advmod attr obl det pobj obl det amod pobj aux nsubj advmod obj,adverbial_clause,spo
ccomp ref nsubj advmod obl acl,adverbial_clause,sov
cc case mark nsubj advmod advcl,prepositional_phrase,sv
ccomp nsubj obj advmod obj,adverbial_clause,vso
ccomp advmod case obl advcl nsubj advmod ccomp advmod root nsubj obj,prepositional_phrase,osp
case det obl case obl obj advmod ccomp det obj mark amod relcl case det obl advmod,prepositional_phrase,v
case aux:pass acl:relcl iobj,prepositional_phrase,v
mark case obl,prepositional_phrase,sv
acl:relcl X,unknown_chunk,v
cc nsubj root aux advmod,adverbial_clause,sp
cc conj,unknown_chunk,v
case det obl cc conj obj,prepositional_phrase,v
cc det nsubj,noun_phrase,vs
conj obj advmod mark xcomp cc det nsubj,subordinate_clause,ovs
conj neg advmod advmod obj cc conj cc conj obj case det obl X X,prepositional_phrase,v
cc det nsubj punct nsubj obj det xcomp acl,noun_phrase,sov
punct root obj advmod advmod advmod,adverbial_clause,p
mark mark xcomp,subordinate_clause,v
case nmod:poss obl punct mark case advcl mark nsubj advmod advmod advmod advmod advmod,prepositional_phrase,ovs
ccomp mark nsubj advmod advcl,subordinate_clause,sv
cc advmod nsubj root advmod advmod,adverbial_clause,sp
case det obl case obl punct det obj,prepositional_phrase,v
cc det obj punct,noun_phrase,v
conj case det nmod:poss obl advmod,prepositional_phrase,v
cc det obj obj det obj case det obl cc det obj case det obl,prepositional_phrase,v
cc case obl punct mark nsubj amod obj advcl xcomp,prepositional_phrase,osv
case det obl nsubj case xcomp advcl,prepositional_phrase,osv
cc det obj appos ccomp ref det advmod acomp acl:relcl root nsubj,adverbial_clause,ops
ccomp obl det obj xcomp X X X,noun_phrase,v
cc advmod root advmod det nsubj appos,adverbial_clause,ps
cc conj case nmod punct cc det nsubj conj,prepositional_phrase,sv
case det obl xcomp,prepositional_phrase,v
case amod obl,prepositional_phrase,v
case nmod cc case nmod punct,prepositional_phrase,unknown
cc root aux,main_clause,p
ccomp obl det obl obl det amod obl nsubj parataxis obl obl,noun_phrase,ovs
mark xcomp advmod advmod,subordinate_clause,v
mark nsubj nsubj advmod,subordinate_clause,s
acl:relcl ccomp amod obj xcomp,noun_phrase,v
cc conj advmod obl det amod obl obl obl X,adverbial_clause,v
cc root nsubj det obj,noun_phrase,pso
relcl case acl:relcl,prepositional_phrase,v
punct nsubj,unknown_chunk,vs
conj advmod xcomp obj punct ccomp nsubj advmod csubj,adverbial_clause,os
case obl acl:relcl nsubj advmod xcomp csubj,prepositional_phrase,osv
punct conj,unknown_chunk,v
case nmod advmod csubj advmod xcomp det amod obj advmod obl pobj,prepositional_phrase,svo
mark advmod det nsubj:pass advcl aux:pass,subordinate_clause,sv
punct root nsubj obj det det appos nmod det obl,noun_phrase,pso
punct ref advmod aux aux,adverbial_clause,sv
acl:relcl punct nsubj neg aux,unknown_chunk,sv
conj advmod obj,adverbial_clause,v
punct nsubj aux obj det,noun_phrase,svo
conj,unknown_chunk,v
nsubj root det attr,noun_phrase,sp
punct nsubj amod conj,noun_phrase,s
advmod root det obj,adverbial_clause,p
mark advcl case obl cc conj mark advmod advmod ccomp det nsubj advmod obj,prepositional_phrase,osv
ccomp ccomp nsubj,complement_clause,vs
case obl obj,prepositional_phrase,v
ccomp case obl,prepositional_phrase,v
punct cc,unknown_chunk,v
ccomp nsubj,complement_clause,vs
ccomp,complement_clause,v
cc nsubj,unknown_chunk,s
conj amod obj compound:prt cc nsubj det conj obj,noun_phrase,osv
case obl cc conj det case det obl,prepositional_phrase,v
case obl case det obl,prepositional_phrase,v
conj case amod obl case obl nsubj det det obj advmod root X X,prepositional_phrase,osp
cc det nsubj nsubj acl obj,noun_phrase,sv
cc root,main_clause,p
mark nsubj advmod ccomp conj mark nsubj obj xcomp punct advmod advmod nummod nsubj mark advmod obj conj mark nsubj advcl X,subordinate_clause,sov
advmod root neg attr,adverbial_clause,p
ccomp nsubj,complement_clause,vs
ccomp amod nmod acomp punct advmod advmod conj obl advmod advmod xcomp,adverbial_clause,v
cc det nsubj root aux det obj advmod advmod,adverbial_clause,spo
cc conj advmod,adverbial_clause,v
root nsubj acomp,main_clause,ps
prep pobj advcl amod obl mark xcomp advcl nsubj ccomp aux advmod advmod punct conj det nsubj,prepositional_phrase,osv
punct advmod nsubj advcl,subordinate_clause,sv
prep det pobj xcomp,prepositional_phrase,v
prep det amod pobj prep det pobj cc conj det amod pobj ref nsubj,prepositional_phrase,ovs
acl:relcl prep det pobj,prepositional_phrase,v
case obl root det nsubj advmod cc conj obj xcomp,prepositional_phrase,ops
punct mark nsubj det amod attr advcl,subordinate_clause,sv
cc advcl det nsubj advcl obl det pobj xcomplement,subordinate_clause,sov
cc conj obl det amod pobj,noun_phrase,v
punct advmod root nsubj mark nsubj det obj,subordinate_clause,pso
ccomp,complement_clause,unknown
advmod root det nsubj xcomp,adverbial_clause,ps
punct advmod case obl obl,prepositional_phrase,v
mark nsubj det obl aux advcl,subordinate_clause,sov
cc mark advmod advmod nsubj advcl xcomp,subordinate_clause,sv
cc advmod conj punct advmod root nsubj det obj,adverbial_clause,pso
mark advmod amod mark nsubj acl det obj aux xcomp,subordinate_clause,sov
case obl advmod root det amod nsubj,prepositional_phrase,ops
punct relcl acl advmod advmod,adverbial_clause,v
mark nsubj nummod obj amod ccomp advmod nsubj advmod aux xcomp punct,subordinate_clause,sov
cc conj attr nsubj,unknown_chunk,vs
case obl advmod conj nsubj obj amod det amod obj,prepositional_phrase,ovs
punct cc conj nsubj det obj xcomp cc conj advmod advmod,adverbial_clause,sov
case ccomp aux,prepositional_phrase,v
punct cc advmod det nsubj,adverbial_clause,vs
case det obl acl det obj,prepositional_phrase,v
conj case det obl xcomp,prepositional_phrase,v
punct nsubj conj attr acomp,unknown_chunk,sv
punct conj,unknown_chunk,v
cc conj,unknown_chunk,unknown
cc mark nsubj conj det amod obj advmod xcomp,subordinate_clause,sv
cc conj neg advmod advmod nsubj root det obj prt X,adverbial_clause,spo
case det obl nsubj advmod advcl advmod root advmod det amod obj,prepositional_phrase,spo
cc conj acomp obl det amod pobj,noun_phrase,v
cc conj obj xcomp obj,infinitive_clause,v
case obl,prepositional_phrase,v
cc conj obl det amod pobj obl det pobj X X X,noun_phrase,v
cc mark advmod mark nsubj advmod advcl,subordinate_clause,sv
punct advmod advcl det det nsubj nmod amod obj,subordinate_clause,vso
punct mark mark det det nsubj obl det det pobj advmod ccomp xcomp,subordinate_clause,sov
punct cc root,main_clause,p
case det obl case det obl case det obl,prepositional_phrase,unknown
cc mark advmod mark det advcl advmod root det det nsubj:pass aux:pass obl det det amod,subordinate_clause,pso
case ref nsubj xcomp acl:relcl X,prepositional_phrase,sv
advmod nsubj advcl obl pobj obl det pobj,subordinate_clause,svo
punct advmod advcl det amod nsubj obl pobj,subordinate_clause,vso
punct mark nsubj root,subordinate_clause,sp
ccomp nsubj advcl cc advmod conj,subordinate_clause,sv
case obl advmod advmod nsubj root,prepositional_phrase,osp
case xcomp advcl advmod,prepositional_phrase,v
cc conj det obj,noun_phrase,v
case det amod pobj cc obj ref nsubj case aux acl,prepositional_phrase,osv
punct mark nsubj obj aux,subordinate_clause,sov
ccomp case det amod pobj,prepositional_phrase,v
case det amod pobj,prepositional_phrase,unknown
cc advmod pobj det advmod obj nsubj appos det attr advmod,adverbial_clause,ovs
