chunk,phrase_type,word_order
cc nsubj root obj case det obl cc conj det nsubj obj,prepositional_phrase,spo
case amod obl,prepositional_phrase,v
cc mark nsubj advcl,subordinate_clause,sv
ccomp nsubj ccomp xcomp,infinitive_clause,sv
cc neg advmod conj xcomp root nsubj prt advmod amod obj mark xcomp advcl,subordinate_clause,pso
mark det nmod:poss nsubj aux xcomp obl nmod:poss pobj advcl X,subordinate_clause,sov
cc case mark obj nsubj advmod obl,prepositional_phrase,sv
mark nsubj obj ccomp advmod root nsubj,subordinate_clause,sop
case nmod:poss obl cc conj case nmod:poss obl X X,prepositional_phrase,v
advmod root nsubj obl det amod obj mark xcomp,subordinate_clause,pso
mark advmod det nsubj advmod acomp ccomp conj nsubj obj xcomp nsubj,subordinate_clause,svo
conj mark xcomp X X X,subordinate_clause,v
cc advmod nsubj conj acomp xcomp,adverbial_clause,sv
punct ref advmod amod obj aux advmod poss nmod pobj mark nsubj acl amod obj punct,subordinate_clause,osv
conj nsubj obj,unknown_chunk,vso
case det obl advmod nsubj obj aux advcl advmod,prepositional_phrase,osv
punct cc root,main_clause,p
case obl advmod,prepositional_phrase,unknown
cc mark det nsubj obj advcl advmod advmod,subordinate_clause,sov
conj advmod root nsubj prt mark xcomp X,subordinate_clause,ps
vocative vocative nsubj root obj,main_clause,spo
case advmod xcomp mark nsubj poss nmod obj,prepositional_phrase,so
ccomp cc,complement_clause,v
conj case amod obl mark advmod advmod advcl X,prepositional_phrase,unknown
voc punct root nsubj,main_clause,ps
punct nsubj,unknown_chunk,vs
ccomp advmod xcomp,adverbial_clause,v
punct mark nsubj advcl,subordinate_clause,sv
punct advmod xcomp advmod nsubj xcomp,adverbial_clause,vs
discourse compound voc root det nsubj det nsubj,noun_phrase,ps
conj iobj advmod nsubj conj prep compound det amod pobj,prepositional_phrase,osv
cc conj prep det pobj mark det nsubj advmod conj obl det nmod pobj X X X,prepositional_phrase,osv
vocative nsubj root advmod advmod obl det obj X,adverbial_clause,spo
mark nsubj advcl root nsubj nsubj advmod,subordinate_clause,sp
ccomp advmod obj case nmod:poss obl mark nsubj advmod advcl xcomp advmod,prepositional_phrase,osv
conj case det obl nsubj obj xcomp acl,prepositional_phrase,vos
case det amod obl,prepositional_phrase,v
mark mark xcomp det obj case det amod obl nsubj obj acl,prepositional_phrase,ovs
cc conj,unknown_chunk,v
case det det obl,prepositional_phrase,v
mark nsubj obj advcl vocative,subordinate_clause,so
conj nsubj obj obl obj,unknown_chunk,sov
case nmod:poss amod obl X X X X X X X X X,prepositional_phrase,v
case det advmod root nsubj case det obl cc conj,prepositional_phrase,pso
case det obl advmod cc conj det nmod:poss obj neg advmod acl advmod parataxis xcomp,prepositional_phrase,unknown
cc nsubj root,main_clause,sp
case det obl,prepositional_phrase,v
cc conj advmod,adverbial_clause,unknown
cc det nsubj root det obj cc conj acl advmod xcomp,adverbial_clause,spo
prep det pobj advcl det obj,prepositional_phrase,unknown
nsubj root obl,main_clause,spo
case cc conj,prepositional_phrase,v
voc punct iobj root,main_clause,p
mark nsubj neg obj cc mark nsubj neg,subordinate_clause,sov
case obl obj advmod,prepositional_phrase,v
mark det nsubj advcl,subordinate_clause,s
voc root nsubj nsubj,main_clause,ps
ccomp mark nsubj advmod det,subordinate_clause,vs
ccomp advcl nsubj advmod obj,subordinate_clause,so
case det obl advcl advmod,prepositional_phrase,v
ccomp iobj case pobj X X X X,prepositional_phrase,v
advmod parataxis obj vocative punct root det nsubj,adverbial_clause,ops
punct mark nsubj,subordinate_clause,vs
ccomp advmod mark nsubj neg advmod xcomp ccomp,subordinate_clause,s
advmod root xcomp det nsubj det nsubj,adverbial_clause,ps
cc conj advmod det obj,adverbial_clause,v
cc det conj cc conj case det obl,prepositional_phrase,v
mark obj nsubj,subordinate_clause,os
case det obl advcl,prepositional_phrase,v
cc conj obj advmod amod obj cc conj mark nsubj case det obl advcl advmod X X X X,prepositional_phrase,os
cc advmod nsubj root obj det nsubj nsubj obl det pobj acl obl det amod pobj obl pobj,adverbial_clause,spo
ccomp advmod,adverbial_clause,v
conj nsubj advmod acomp,adverbial_clause,s
cc acomp obl det det pobj nsubj advmod xcomp acl nsubj,adverbial_clause,ovs
conj amod obj X X X X,noun_phrase,v
mark nsubj advcl advmod amod obj,subordinate_clause,svo
case det obl punct mark nsubj obj advmod advmod advcl det obj,prepositional_phrase,osv
case advmod advmod mark mark case obl advmod advcl,prepositional_phrase,v
punct cc advcl,subordinate_clause,v
mark mark nsubj obj advmod ccomp,subordinate_clause,sov
punct advmod nsubj advmod root,adverbial_clause,sp
cc mark nsubj aux root,subordinate_clause,sp
case det obl case det obl appos mark conj nsubj,prepositional_phrase,os
case det obl X,prepositional_phrase,v
advmod root det nsubj xcomp,adverbial_clause,ps
case det obl,prepositional_phrase,unknown
nsubj root advmod advmod xcomp punct nsubj conj advmod xcomp,adverbial_clause,sp
cc conj obj xcomp,infinitive_clause,v
punct mark nsubj advcl attr,subordinate_clause,sv
relcl obj neg advmod xcomp acl,adverbial_clause,v
mark nsubj advmod advcl,subordinate_clause,sv
mark nsubj neg advmod xcomp ccomp advmod root nsubj advmod xcomp X,subordinate_clause,sp
cc advmod det nmod:poss nsubj root det obj compound:prt case det obl punct,prepositional_phrase,spo
cc advmod conj det nsubj obj,adverbial_clause,so
cc advmod mark nsubj advmod advcl nmod:poss obj xcomp advmod root nsubj det obj det nmod advmod amod obl X X,subordinate_clause,sop
cc case obl root nsubj obj,prepositional_phrase,ops
case amod obl mark det nsubj aux xcomp ccomp,prepositional_phrase,osv
cc det conj case det obl,prepositional_phrase,unknown
cc root,main_clause,p
mark mark nsubj ccomp,subordinate_clause,sv
case det obl nmod:poss,prepositional_phrase,unknown
det nsubj root det attr,noun_phrase,sp
cc case amod obl cc conj det det amod attr,prepositional_phrase,v
case det nmod advcl nsubj ccomp,prepositional_phrase,sv
case obl,prepositional_phrase,unknown
cc mark nsubj root,subordinate_clause,sp
mark det nsubj case nmod:poss obl ccomp,prepositional_phrase,sov
punct nsubj,unknown_chunk,vs
conj det obj xcomp,noun_phrase,v
case det obl cc conj,prepositional_phrase,v
punct mark,subordinate_clause,v
case det obl det nsubj advcl xcomp mark nsubj obj,prepositional_phrase,osv
case nmod:poss obl ccomp,prepositional_phrase,v
punct advmod parataxis nsubj advmod,adverbial_clause,sv
case obl punct nsubj parataxis det obj xcomp det amod obj,prepositional_phrase,osv
cc det amod obj punct ref nsubj obl,noun_phrase,ovs
case obj nsubj aux acl:relcl,prepositional_phrase,osv
cc obl det case root nsubj obj,prepositional_phrase,ops
mark obl case cc advcl obj obj xcomp,prepositional_phrase,v
punct cc,unknown_chunk,v
conj obl det,noun_phrase,v
case advmod advmod cc mark advmod obj nsubj obj det obj advcl,prepositional_phrase,sov
mark nsubj det obj acl:relcl,subordinate_clause,sov
advmod root nsubj obj det obl obj nsubj det obl,adverbial_clause,pso
acl:relcl xcomp,infinitive_clause,v
cc root,main_clause,p
case obl,prepositional_phrase,v
mark nsubj obj det nmod xcomp,subordinate_clause,sov
ccomp punct,complement_clause,v
cc advmod,adverbial_clause,v
conj nsubj advmod obj xcomp,adverbial_clause,vso
punct mark nsubj advcl,subordinate_clause,sv
mark nsubj case obj mark xcomp ccomp,prepositional_phrase,sov
mark nsubj advmod,subordinate_clause,vs
case obl ccomp,prepositional_phrase,v
det obl punct mark advmod mark det nsubj advcl punct advmod root det obj compound:prt,subordinate_clause,osp
cc conj obj,unknown_chunk,v
cc conj obj xcomp,infinitive_clause,v
case det obl punct acl:rel acl:relcl,prepositional_phrase,v
case det obl,prepositional_phrase,unknown
cc mark nsubj obj advcl root nsubj obl amod,subordinate_clause,sop
case cc conj det obj obl det,prepositional_phrase,v
case det nmod:poss appos cc,prepositional_phrase,v
conj obl amod det,noun_phrase,v
case ref nsubj advmod xcomp acl:relcl X,prepositional_phrase,sv
cc root,main_clause,p
case det obl cc conj obj advmod obl,prepositional_phrase,v
case det nmod mark nsubj xcomp advcl,prepositional_phrase,sv
cc root,main_clause,p
prep det pobj punct,prepositional_phrase,sv
relcl nsubj advmod punct,adverbial_clause,sv
relcl nsubj advmod punct advcl nsubj advcl,subordinate_clause,sv
ccomp nsubj det acomp,noun_phrase,sv
ccomp obl det det pobj advcl nsubj advcl obj,subordinate_clause,osv
cc conj,unknown_chunk,unknown
cc root advmod,adverbial_clause,p
case det obl obj,prepositional_phrase,sv
acl:relcl advmod advmod advcl advmod obj,subordinate_clause,v
conj cc conj amod,noun_phrase,unknown
punct advmod root det nsubj advmod obl det pobj cc conj obl pobj,adverbial_clause,pso
punct mark nsubj obj advcl obj det nmod,subordinate_clause,sov
advmod root det obj,adverbial_clause,p
punct mark advcl aux advcl obl det nmod,subordinate_clause,v
punct mark nsubj,subordinate_clause,vs
ccomp nummod obj,complement_clause,v
cc conj mark nsubj amod obj appos advmod advmod mark ccomp,subordinate_clause,sov
cc obl det amod pobj obl pobj advmod root obl obj,adverbial_clause,p
case nmod:poss obl ccomp obl det amod pobj X,prepositional_phrase,v
cc mark nsubj advmod conj punct mark root nsubj case det obl,prepositional_phrase,spo
discourse det advcl case nmod nsubj,prepositional_phrase,vs
acl:relcl advmod,adverbial_clause,v
cc conj,unknown_chunk,v
case obl case obl mark obj nsubj advmod advcl,prepositional_phrase,osv
punct mark nsubj det amod nmod:gen attr root,subordinate_clause,sp
nsubj nummod root nmod:poss obj,main_clause,spo
punct nsubj amod,noun_phrase,vs
conj advmod obl det pobj,adverbial_clause,v
punct nsubj,unknown_chunk,vs
conj obl det pobj punct advmod advmod,adverbial_clause,v
mark conj,subordinate_clause,v
cc mark nsubj advmod xcomp advcl,subordinate_clause,sv
punct nsubj root nummod obj obl det,noun_phrase,spo
case punct nsubj obj nsubj acl:relcl attr,prepositional_phrase,sov
acl:relcl cc det amod conj,noun_phrase,unknown
cc mark advmod nsubj obj advcl,subordinate_clause,sv
punct nsubj root advmod obl amod obj,adverbial_clause,spo
cc conj advmod cc conj advmod acomp aux,adverbial_clause,v
cc conj obj ref amod obj ref nsubj acl,noun_phrase,osv
punct mark nsubj,subordinate_clause,vs
mark advmod acomp advcl,subordinate_clause,v
mark nsubj obj ccomp aux,subordinate_clause,sov
punct cc,unknown_chunk,v
conj iobj obj xcomp,infinitive_clause,v
advmod root nsubj advmod advmod amod obj punct,adverbial_clause,pso
mark det obj nsubj advcl obl pobj,subordinate_clause,osv
cc conj,unknown_chunk,unknown
det obl punct advcl nsubj aux advcl,subordinate_clause,osv
cc conj aux xcomp obj,infinitive_clause,v
case det obl punct advmod root nsubj,prepositional_phrase,ops
ccomp obj obj nsubj advmod aux,adverbial_clause,sv
ccomp,complement_clause,v
nmod obj parataxis nsubj nsubj parataxis advmod,adverbial_clause,osv
mark det obj aux xcomp nsubj root advmod advmod acomp,subordinate_clause,osp
ccomp nsubj obj aux,complement_clause,sov
ccomp aux xcomp nsubj advmod parataxis,adverbial_clause,vs
case det obl case det obl,prepositional_phrase,sv
acl:relcl nsubj acl:relcl xcomp case det obl X X X X,prepositional_phrase,sov
advmod mark advmod nsubj,subordinate_clause,vs
case xcomp,prepositional_phrase,v
cc xcomp root,infinitive_clause,p
punct mark,subordinate_clause,v
case ccomp case det amod obl cc case det obl punct nsubj obj ccomp,prepositional_phrase,osv
cc conj cc conj,unknown_chunk,unknown
cc advmod root nsubj xcomp,adverbial_clause,ps
mark xcomp,subordinate_clause,v
mark nsubj ccomp attr,subordinate_clause,sv
cc conj mark nsubj advmod obl,subordinate_clause,vso
ccomp,complement_clause,v
mark nsubj advcl,subordinate_clause,sv
case obl advmod xcomp punct root det nsubj obj,prepositional_phrase,ops
punct advmod,adverbial_clause,v
conj nsubj xcomp,infinitive_clause,sv
mark det nsubj ccomp advmod mark nsubj advcl,subordinate_clause,sv
case obl punct parataxis nsubj,prepositional_phrase,ovs
punct nsubj parataxis iobj obj,unknown_chunk,svo
punct root det nsubj,noun_phrase,ps
mark nsubj iobj advcl,subordinate_clause,sov
cc conj,unknown_chunk,v
punct mark nsubj advmod advmod aux,subordinate_clause,sv
ccomp punct advmod advcl nsubj attr ref advmod,subordinate_clause,vs
acl:relcl aux,unknown_chunk,v
punct mark nsubj xcomp advcl advmod obj,subordinate_clause,svo
voc punct root nsubj punct nsubj,main_clause,ps
ccomp case obj xcomp,prepositional_phrase,v
punct mark nsubj neg advcl,subordinate_clause,vs
case det obl,prepositional_phrase,unknown
nsubj root,main_clause,sp
punct parataxis nsubj,unknown_chunk,vs
punct obj obj advmod obl det pobj,adverbial_clause,v
ccomp advmod,adverbial_clause,v
mark xcomp mark det nsubj advmod ccomp expl advcl nsubj ccomp,subordinate_clause,sv
mark root nsubj case obl,prepositional_phrase,pso
det acl:relcl mark nsubj obl obl cc conj obl,subordinate_clause,sov
case det obl obj nsubj aux root,prepositional_phrase,osp
cc advmod amod root det nsubj obj punct,adverbial_clause,pso
mark nsubj acl obj obj det nsubj advcl,subordinate_clause,sov
advmod root nsubj,adverbial_clause,ps
case det obl,prepositional_phrase,v
cc conj punct,unknown_chunk,v
mark nsubj det obj advmod xcomp advcl,subordinate_clause,sov
mark nsubj advcl,subordinate_clause,sv
cc advmod root obl,adverbial_clause,p
case det obl nmod,prepositional_phrase,v
cc det conj obl det pobj,noun_phrase,unknown
cc case advmod punct mark nsubj obj advcl punct root det nsubj iobj obj,prepositional_phrase,sop
case det obl mark det nsubj acl:relcl,prepositional_phrase,osv
case obl nsubj det obj,prepositional_phrase,osv
case det obl acl:relcl,prepositional_phrase,v
voc punct root det amod nsubj,noun_phrase,ps
punct advmod parataxis nsubj advmod advmod,adverbial_clause,sv
punct conj nsubj,unknown_chunk,vs
punct mark nsubj advmod,subordinate_clause,vs
ccomp xcomp,infinitive_clause,v
case obl punct,prepositional_phrase,v
mark xcomp,subordinate_clause,v
mark ccomp nsubj det obj,subordinate_clause,sv
mark advcl nsubj,subordinate_clause,s
case obl,prepositional_phrase,unknown
nsubj root obj iobj neg,main_clause,spo
punct parataxis det amod nsubj,noun_phrase,vs
punct ccomp nsubj obj obl pobj,complement_clause,vso
ccomp punct advcl nsubj advcl,subordinate_clause,sv
ccomp nsubj neg advmod advmod obl pobj advmod ccomp advmod obj,adverbial_clause,so
nsubj ccomp advcl nsubj ccomp punct cc conj nsubj obj xcomp,subordinate_clause,svo
punct root nsubj,main_clause,ps
cc advmod root nsubj obj,adverbial_clause,pso
prep det amod pobj prep det pobj cc conj det amod obj,prepositional_phrase,v
prep det amod pobj,prepositional_phrase,v
advmod root det amod nsubj,adverbial_clause,ps
advmod root det nsubj,adverbial_clause,ps
punct mark nsubj advcl,subordinate_clause,sv
cc nsubj root obl,main_clause,spo
cc conj,unknown_chunk,v
mark nsubj advmod advmod amod obj advmod advmod amod aux,subordinate_clause,sov
ccomp cc,complement_clause,v
conj advmod advmod,adverbial_clause,v
mark mark det det nsubj obl det obl advmod aux ccomp X,subordinate_clause,sov
mark obl case advcl advmod root nsubj X,prepositional_phrase,ops
advmod root iobj voc,adverbial_clause,p
punct nsubj root det attr ref nmod:poss xcomp,noun_phrase,sp
acl:relcl case det obl,prepositional_phrase,v
punct nsubj root advmod advmod amod attr advmod det obl,adverbial_clause,spo
cc advmod root nsubj advmod,adverbial_clause,ps
case det obl mark nsubj neg advcl,prepositional_phrase,ovs
cc advmod acomp conj mark nsubj,subordinate_clause,vs
case aux ccomp X,prepositional_phrase,v
obl nmod punct root det nsubj obj,noun_phrase,ops
punct nsubj,unknown_chunk,vs
conj obj xcomp,infinitive_clause,v
punct iobj conj advmod obl pobj nsubj advmod,adverbial_clause,ovs
punct cc,unknown_chunk,v
conj obj obl det pobj,noun_phrase,v
cc conj obj obl det pobj,noun_phrase,v
cc mark nsubj advcl,subordinate_clause,sv
case det obl punct advmod root nsubj,prepositional_phrase,ops
case obl,prepositional_phrase,v
nsubj ccomp det advmod obj,adverbial_clause,svo
punct root nsubj,main_clause,ps
cc nsubj root case obl advmod punct,prepositional_phrase,spo
cc det nsubj case det obl conj,prepositional_phrase,sov
case det obl punct nsubj case obl,prepositional_phrase,osv
acl:relcl cc det obj advmod conj,adverbial_clause,v
punct mark nsubj advmod advcl,subordinate_clause,sv
advmod nsubj root cc conj compound nsubj case obl acl:relcl advcl advmod,prepositional_phrase,spo
mark mark nsubj det obj advcl,subordinate_clause,svo
case det obl X X,prepositional_phrase,unknown
cc det nsubj nmod root obj case det obl punct nsubj,prepositional_phrase,spo
cc det nsubj,noun_phrase,vs
punct cc conj advmod nummod obl cc conj,adverbial_clause,v
case det obl case det obl,prepositional_phrase,unknown
nsubj root,main_clause,sp
mark advmod obj ccomp det nsubj,subordinate_clause,ovs
punct acl case amod nmod punct cc conj,prepositional_phrase,v
mark advmod advcl mark det nsubj advmod advcl,subordinate_clause,sv
cc conj poss obj advmod cc conj advmod xcomp,adverbial_clause,v
case,prepositional_phrase,unknown
det nsubj nmod root obj xcomp obl,noun_phrase,spo
mark advmod advmod nsubj,subordinate_clause,vs
case xcomp advcl,prepositional_phrase,v
cc conj det obj prt obl det det obj advmod obl,adverbial_clause,v
conj,unknown_chunk,v
cc det amod nsubj root advmod advmod advmod obj nsubj acl det obj,adverbial_clause,spo
case det obl punct obj nsubj obj acl,prepositional_phrase,osv
case det obl xcomp acl,prepositional_phrase,v
cc conj advmod advmod advmod,adverbial_clause,v
mark det nsubj amod amod advcl,subordinate_clause,sv
punct obj nsubj advmod,adverbial_clause,vs
case det obl case det obl acl,prepositional_phrase,v
case det obl mark nsubj advmod advmod advcl det amod appos det obj det iobj,prepositional_phrase,osv
case det obl cc root advmod advcl,prepositional_phrase,p
mark nsubj obj advmod xcomp ccomp,subordinate_clause,sov
cc mark obj det nsubj advmod,subordinate_clause,vos
ccomp,complement_clause,v
voc voc root nsubj nsubj,main_clause,ps
ccomp mark det obj,subordinate_clause,v
cc conj mark nsubj det obj advcl,subordinate_clause,so
case nmod:poss obl,prepositional_phrase,v
mark nsubj advcl det obj xcomp,subordinate_clause,sov
mark xcomp nsubj parataxis advmod det attr,subordinate_clause,sv
case det nmod X X X X,prepositional_phrase,unknown
cc obl det pobj obj nsubj aux acl:relcl advmod root obj det compound nsubj xcomp obj aux xcomp obl det pobj X,adverbial_clause,osp
cc mark nsubj obj aux advcl,subordinate_clause,sov
punct advmod root nsubj,adverbial_clause,ps
case det obl,prepositional_phrase,unknown
root det obj,noun_phrase,p
cc conj obj,unknown_chunk,v
case det nmod nmod nmod obl det amod appos obj nsubj acl:relcl obj obj nsubj,prepositional_phrase,os
acl:relcl case det obl X X X,prepositional_phrase,v
cc root iobj,main_clause,p
mark nsubj ccomp det amod obj,subordinate_clause,svo
acl:relcl nsubj obj ccomp,complement_clause,sov
nsubj aux obl nmod root,main_clause,sop
mark advcl cc conj cc advmod,subordinate_clause,v
conj mark nsubj advmod advcl,subordinate_clause,sv
cc nsubj root det attr ref nsubj,noun_phrase,sp
relcl advmod acomp,adverbial_clause,v
case obj mark xcomp punct,prepositional_phrase,v
cc conj advmod,adverbial_clause,v
case nmod:poss obl mark advmod nsubj advmod advcl,prepositional_phrase,osv
cc nsubj root advmod,adverbial_clause,sp
mark nsubj ccomp punct,subordinate_clause,sv
mark nsubj obj aux det iobj,subordinate_clause,sov
ccomp punct,complement_clause,v
mark nsubj,subordinate_clause,vs
case obl ccomp,prepositional_phrase,v
case det obl root nsubj advmod xcomp,prepositional_phrase,ops
punct mark nsubj ccomp det attr ref nsubj iobj advmod det amod obl aux acl,subordinate_clause,sov
punct cc advmod,adverbial_clause,v
conj nsubj det obj,noun_phrase,sv
cc conj,unknown_chunk,v
mark nsubj obj ccomp,subordinate_clause,sov
voc root det nsubj,noun_phrase,ps
mark obj nsubj iobj det obj neg aux,subordinate_clause,osv
ccomp conj nsubj iobj,complement_clause,vso
case obl acl obj nsubj,prepositional_phrase,vos
case det obl acl obj nsubj iobj det obj advcl aux,prepositional_phrase,osv
case det obl,prepositional_phrase,v
cc mark nsubj advcl case det obl xcomp,prepositional_phrase,sv
cc advmod mark det nsubj aux advmod case advcl mark nsubj case det obl aux case case det obl conj case obl advmod advmod X X X X X,prepositional_phrase,sov
mark advmod root obj xcomp,subordinate_clause,p
ccomp nsubj iobj obj ccomp aux,complement_clause,sov
cc neg iobj advmod,adverbial_clause,v
mark nsubj advcl,subordinate_clause,sv
ccomp nsubj iobj vocative,complement_clause,so
ccomp det amod obj nsubj det obj,noun_phrase,osv
acl:relcl aux X X X,unknown_chunk,v
cc nsubj root nsubj,main_clause,sp
ccomp obj advmod xcomp,adverbial_clause,v
cc mark obl case obl,prepositional_phrase,v
mark nsubj advmod,subordinate_clause,s
acl:relcl aux mark nsubj advmod,subordinate_clause,vs
ccomp X X,complement_clause,v
case det obl punct root det nsubj,prepositional_phrase,ops
punct mark nsubj obj advcl,subordinate_clause,sov
advmod root det nsubj obl det pobj appos,adverbial_clause,pso
cc conj advmod,adverbial_clause,v
mark nsubj obj xcomp ccomp,subordinate_clause,sov
advmod punct parataxis nsubj,adverbial_clause,vs
punct advmod obj,adverbial_clause,v
punct ccomp nsubj advmod xcomp root det nsubj,adverbial_clause,sp
cc nsubj root obj advmod,adverbial_clause,spo
cc conj,unknown_chunk,v
punct nsubj parataxis obj xcomp,infinitive_clause,sov
mark advcl mark nsubj advcl,subordinate_clause,sv
cc det nsubj root iobj mark advmod mark nsubj advcl obl det pobj,subordinate_clause,spo
cc nsubj root advmod punct,adverbial_clause,sp
cc det nsubj conj advmod advmod mark obj mark xcomp,subordinate_clause,sov
punct mark nsubj obj advmod neg,subordinate_clause,vso
ccomp aux xcomp,infinitive_clause,v
punct nsubj conj,unknown_chunk,sv
mark det obl aux xcomp,subordinate_clause,v
mark nsubj obj advcl punct mark advcl nsubj obj obl det pobj,subordinate_clause,sov
punct mark det nsubj aux advcl,subordinate_clause,sv
punct cc advcl,subordinate_clause,v
mark advmod obl mark nsubj advcl obl det pobj,subordinate_clause,osv
punct advmod nsubj root acomp,adverbial_clause,sp
cc mark nsubj advmod xcomp root,subordinate_clause,sp
mark nsubj ccomp mark,subordinate_clause,sv
conj nsubj advmod xcomp advmod,adverbial_clause,s
cc conj det obj nmod xcomp,noun_phrase,v
cc conj advmod case det obl cc conj case nmod:poss obj,prepositional_phrase,sv
relcl poss acomp cc acomp acl X X,unknown_chunk,unknown
cc aux root obj nmod det pobj,noun_phrase,p
punct acl:relcl obj poss,unknown_chunk,sv
acl:relcl punct mark nsubj ccomp xcomp,subordinate_clause,sv
nsubj root,main_clause,sp
nsubj root advmod xcomp,adverbial_clause,sp
punct mark nsubj advcl punct cc nsubj conj advmod amod attr,subordinate_clause,sv
punct cc obj conj nsubj advmod xcomp,adverbial_clause,osv
punct advmod nsubj conj,adverbial_clause,sv
case obl punct nsubj det obj obl obj,prepositional_phrase,ovs
ccomp punct obj iobj,complement_clause,v
conj,unknown_chunk,v
cc nsubj conj advmod,adverbial_clause,sv
case det obl punct,prepositional_phrase,v
mark nsubj obj advmod,subordinate_clause,vso
case obl aux root,prepositional_phrase,p
cc mark nsubj obl,subordinate_clause,vso
case det obl aux advcl det obj ref nsubj,prepositional_phrase,ovs
acl:relcl punct root det nsubj,noun_phrase,ps
case iobj,prepositional_phrase,v
mark advcl obj nsubj det det obj nsubj advmod acl:relcl,subordinate_clause,osv
voc punct nsubj root xcomp det amod obj obl det amod obj punct acl det obj nmod xcomp acl,noun_phrase,spo
punct cc conj iobj det obj,noun_phrase,v
cc conj iobj obj nsubj advmod,adverbial_clause,ovs
ccomp obj obl det amod obj advmod punct mark nsubj obj advcl nsubj advmod advmod,subordinate_clause,ovs
conj advmod nsubj advmod,adverbial_clause,vs
punct advmod,adverbial_clause,v
conj nsubj advmod iobj obl obj xcomp,adverbial_clause,sov
cc mark nsubj xcomp advcl,subordinate_clause,sv
case obl det obj ccomp nsubj nsubj advmod advmod advmod advcl xcomp,prepositional_phrase,osv
punct advmod root,adverbial_clause,p
case obl punct,prepositional_phrase,v
cc nsubj conj obj advmod xcomp,adverbial_clause,sov
mark nsubj iobj xcomp advcl,subordinate_clause,sov
cc advmod det nsubj root det obj advmod,adverbial_clause,spo
conj nsubj obj amod obj cc conj mark ccomp nsubj nsubj advcl det obj advmod aux xcomp,subordinate_clause,sov
mark nsubj advmod advmod,subordinate_clause,sv
conj mark det amod amod,subordinate_clause,v
ccomp case obl aux xcomp conj X X,prepositional_phrase,v
cc nsubj flat root,main_clause,sp
case obl,prepositional_phrase,v
root det obj case det obl punct,prepositional_phrase,p
mark nsubj aux neg obj advmod advcl advmod obj,subordinate_clause,svo
punct advmod parataxis nmod:poss nsubj det obj xcomp,adverbial_clause,vso
punct mark nsubj amod obj advcl advmod,subordinate_clause,sov
mark xcomp advmod mark nsubj det obj advcl nsubj,subordinate_clause,sov
acl:relcl aux det obj mark xcomp,subordinate_clause,v
cc advmod root nsubj,adverbial_clause,ps
conj case obl,prepositional_phrase,v
case amod obl advcl mark nsubj,prepositional_phrase,os
case aux ccomp X X,prepositional_phrase,v
cc root obj,main_clause,p
case det amod obl cc conj,prepositional_phrase,v
case det obl xcomp,prepositional_phrase,v
cc mark nsubj acomp advcl,subordinate_clause,sv
punct mark,subordinate_clause,v
conj nsubj det obj,noun_phrase,vso
case det obl cc conj case det obl,prepositional_phrase,v
cc conj,unknown_chunk,v
case obl cc root det obj det nmod nmod,prepositional_phrase,p
cc nsubj advcl acomp,subordinate_clause,sv
