chunk,phrase_type,word_order
case pobj prep det amod pobj acl:relcl poss nsubj prep root xcomp,prepositional_phrase,osp
prep det det pobj,prepositional_phrase,sv
acl:relcl advmod pobj acl xcomp X,adverbial_clause,v
case det obl root acomp det nsubj cc det conj advcl nsubj advmod,prepositional_phrase,ops
ccomp mark nsubj det compound obj neg,subordinate_clause,so
ccomp xcomp advcl mark det det compound obj advcl advmod amod obj,subordinate_clause,v
cc conj obj advmod obl mark advmod,subordinate_clause,v
conj det obj ccomp X X X,noun_phrase,v
cc det nsubj advmod root advmod obl case det obl nsubj advmod advmod acl:relcl,prepositional_phrase,spo
cc conj,unknown_chunk,v
voc voc punct nsubj aux advmod amod obj root obj iobj det nsubj,adverbial_clause,sop
ccomp advmod amod obj punct obj nsubj obj,adverbial_clause,ovs
case obl aux,prepositional_phrase,v
ccomp case det advmod amod obl advcl,prepositional_phrase,v
case det amod obl,prepositional_phrase,unknown
voc punct root advmod xcomp,adverbial_clause,p
punct advmod,adverbial_clause,v
conj det amod nsubj advmod,adverbial_clause,vs
punct nsubj obj advmod acl,adverbial_clause,sov
det nsubj root xcomp,noun_phrase,sp
case pobj pobj relcl aux obj acl,prepositional_phrase,v
cc conj nsubj acl nsubj parataxis advmod,adverbial_clause,sv
case det amod amod nmod pobj,prepositional_phrase,v
conj mark nsubj aux,subordinate_clause,sv
ccomp conj nsubj aux advmod advmod,adverbial_clause,sv
ccomp xcomp advcl expl iobj obj nsubj,subordinate_clause,ovs
ccomp X X X,complement_clause,v
advmod root nsubj advmod advmod advmod xcomp,adverbial_clause,ps
case amod obl case det amod obl mark nsubj obj,prepositional_phrase,ovs
ccomp aux advmod,adverbial_clause,v
mark nsubj advmod aux advcl,subordinate_clause,sv
mark iobj advmod ccomp mark nsubj advmod advcl,subordinate_clause,ovs
case amod obl advmod conj nsubj advmod xcomp X X X,prepositional_phrase,osv
mark nsubj case det nmod advcl punct mark advcl nsubj advmod advmod,prepositional_phrase,sv
case det conj cc conj obj det obj,prepositional_phrase,sv
relcl det nmod acl aux xcomp cc root mark nsubj advmod,subordinate_clause,ps
ccomp advmod advmod advmod,adverbial_clause,v
conj mark mark nsubj aux xcomp obj,subordinate_clause,sv
case det amod obl,prepositional_phrase,v
mark det nsubj advmod conj mark nsubj obj advmod aux ccomp X X X X,subordinate_clause,sov
cc advcl advmod advcl det nsubj advcl mark nsubj advmod,subordinate_clause,sv
ccomp xcomp,infinitive_clause,v
mark root expl,subordinate_clause,p
case amod obl mark nsubj advmod advcl,prepositional_phrase,os
mark nsubj obj advmod,subordinate_clause,so
ccomp xcomp case det obl X X,prepositional_phrase,v
cc root,main_clause,p
case det obl xcomp,prepositional_phrase,unknown
discourse advmod punct nsubj root obj xcomp obl det pobj,adverbial_clause,spo
acl:relcl nsubj aux relcl,unknown_chunk,sv
punct nsubj aux iobj conj det amod,noun_phrase,sov
cc det conj obj acl:relcl nsubj aux acl:relcl punct,noun_phrase,osv
cc nsubj conj det attr obl det pobj,noun_phrase,svo
advmod nsubj aux root,adverbial_clause,sp
punct mark advmod mark nsubj obl obl ccomp punct,subordinate_clause,sov
mark nsubj advmod advmod advmod,subordinate_clause,sv
cc advmod advmod advmod ccomp,adverbial_clause,v
mark nsubj obl aux advcl,subordinate_clause,sov
mark nsubj advmod root,subordinate_clause,sp
mark nsubj,subordinate_clause,vs
ccomp advmod advmod advmod obl det pobj,adverbial_clause,v
punct mark nsubj advmod advmod advmod obj parataxis,subordinate_clause,sov
mark nsubj advcl,subordinate_clause,s
root case obl nsubj obj advmod advmod punct advcl nsubj obj det det obl advcl aux,prepositional_phrase,pos
cc conj case det det obl punct advcl mark nsubj aux det attr,prepositional_phrase,osv
cc det attr,noun_phrase,v
ccomp,complement_clause,v
advmod root iobj obj,adverbial_clause,p
mark nsubj ccomp,subordinate_clause,sv
punct mark nsubj advcl aux obl,subordinate_clause,svo
case case xcomp,prepositional_phrase,v
cc nmod:poss obj cc advcl advmod xcomp,subordinate_clause,v
mark nsubj obj obj xcomp advcl,subordinate_clause,sov
obl det case aux det nsubj obl case advmod root cc obl det case conj obl nsubj xcomp obl det,prepositional_phrase,osp
case advmod ccomp det nsubj obl det,prepositional_phrase,vso
case advmod acl X X,prepositional_phrase,v
cc mark nsubj advcl xcomp,subordinate_clause,sv
punct mark root nsubj,subordinate_clause,ps
mark obj mark nsubj det obj obl det pobj,subordinate_clause,ovs
ccomp,complement_clause,v
discourse parataxis punct conj punct nsubj root iobj det amod obj xcomp,noun_phrase,spo
cc det amod obj punct obj nsubj advmod xcomp ref,adverbial_clause,osv
punct advcl,subordinate_clause,v
mark nsubj ccomp advmod obj acl det obj xcomp,subordinate_clause,sov
ccomp punct,complement_clause,v
mark nsubj parataxis amod obj,subordinate_clause,sv
mark det det obj advmod advmod xcomp,subordinate_clause,unknown
voc voc punct root nsubj,main_clause,ps
punct mark nsubj obj obj,subordinate_clause,sov
punct parataxis amod nsubj mark nsubj acl advmod advmod obj,subordinate_clause,sv
case nmod:poss obl xcomp,prepositional_phrase,v
punct advmod obj cc conj parataxis amod obj cc amod obj punct,adverbial_clause,v
cc parataxis obj xcomp,infinitive_clause,v
cc advmod mark nsubj det advcl,subordinate_clause,vs
case det obl nsubj root iobj advmod advmod advmod advmod X X,prepositional_phrase,osp
voc punct root det nsubj,noun_phrase,ps
punct det amod obj ref nsubj det poss obj,noun_phrase,osv
case obl aux acl,prepositional_phrase,v
mark acl obj amod obj xcomp,subordinate_clause,v
punct nsubj conj neg attr,unknown_chunk,sv
mark nsubj advcl acomp,subordinate_clause,sv
mark advmod det nsubj obl det pobj advcl advmod det amod obj obl det pobj,subordinate_clause,sov
mark nsubj advmod aux advcl obl det pobj,subordinate_clause,svo
cc advmod nsubj advcl,subordinate_clause,sv
mark nsubj advmod aux advcl,subordinate_clause,sv
punct cc nsubj root det amod attr,noun_phrase,sp
acl:relcl nsubj acl,unknown_chunk,s
case det obl root xcomp advmod,prepositional_phrase,p
mark xcomp cc conj advmod mark det nsubj aux,subordinate_clause,sv
ccomp cc conj obj advmod xcomp,adverbial_clause,v
mark nsubj aux,subordinate_clause,sv
ccomp case det obl obj nsubj aux,prepositional_phrase,osv
acl:relcl X X X X,unknown_chunk,v
advmod nsubj root neg xcomp punct advcl nsubj advmod amod advcl aux,subordinate_clause,sp
cc conj,unknown_chunk,v
case amod det nmod xcomp,prepositional_phrase,v
punct ref,unknown_chunk,v
case det nmod acl:relcl punct advmod nsubj obj advcl xcomp det obj,prepositional_phrase,sov
case det amod obl,prepositional_phrase,unknown
cc root obj det obl,noun_phrase,p
case obl xcomp obj advmod acl aux aux,prepositional_phrase,v
cc conj nsubj advmod advmod obj amod acl advmod advmod amod obl,adverbial_clause,sov
cc obl det pobj advmod obl det pobj advmod root nsubj appos xcomp obl det pobj X,adverbial_clause,ops
mark det nsubj cc conj punct nsubj obl det obl acl:relcl xcomp punct root det obj,subordinate_clause,sop
punct nsubj,unknown_chunk,vs
conj advmod xcomp,adverbial_clause,v
cc conj,unknown_chunk,v
punct advmod det advmod nsubj,adverbial_clause,vs
cc conj conj det attr obl det obl,noun_phrase,unknown
cc nsubj parataxis neg acomp advmod root xcomp obl pobj advcl nsubj advcl,subordinate_clause,spo
mark nsubj ccomp obl det pobj X X,subordinate_clause,sov
advmod advmod root nsubj det amod obj mark xcomp,subordinate_clause,pso
punct cc det nsubj,noun_phrase,vs
conj det obj nsubj,noun_phrase,vos
case obl acl:relcl,prepositional_phrase,v
root iobj,main_clause,p
punct parataxis nsubj advmod punct advmod det nsubj parataxis xcomp advmod,adverbial_clause,sv
punct parataxis nsubj,unknown_chunk,vs
punct vocative punct det vocative,noun_phrase,v
ccomp aux obj xcomp,infinitive_clause,v
cc obj cc det obj,noun_phrase,unknown
cc advmod nsubj root obj obl pobj,adverbial_clause,spo
cc det conj appos punct advmod conj obj det iobj det ref advmod acl:relcl obl det pobj,adverbial_clause,v
mark nsubj advcl det obj mark advcl nsubj,subordinate_clause,sov
ccomp case obl mark nsubj advcl,prepositional_phrase,osv
mark nsubj,subordinate_clause,s
ccomp xcomp cc root advmod xcomp obj nsubj,adverbial_clause,pos
acl:relcl advmod,adverbial_clause,v
case det obl X X X X,prepositional_phrase,v
cc root obl det amod obj,noun_phrase,p
mark nsubj advmod advmod acomp advcl,subordinate_clause,sv
mark nsubj neg acomp,subordinate_clause,vs
ccomp obj,complement_clause,v
nsubj ccomp advmod amod acomp,adverbial_clause,sv
punct root nsubj,main_clause,ps
punct mark,subordinate_clause,v
case det obl advmod aux nsubj obl det pobj advmod,prepositional_phrase,osv
ccomp aux:pass,complement_clause,v
punct mark obj aux advmod det obj advcl,subordinate_clause,v
cc root iobj nsubj amod obj advmod det det obl det appos,adverbial_clause,pos
relcl det,noun_phrase,v
case amod attr acl mark nsubj obj aux,prepositional_phrase,sv
ccomp X X,complement_clause,v
mark det amod nsubj nmod det obl advcl obj xcomp advmod advmod,subordinate_clause,sov
mark amod obj acl xcomp root,subordinate_clause,p
cc nsubj root aux mark xcomp advcl amod obl,subordinate_clause,spo
cc det det obj nsubj advmod acl:relcl case obl,prepositional_phrase,os
advmod root nsubj det iobj acomp obl det pobj,adverbial_clause,pso
mark nsubj obj xcomp advcl,subordinate_clause,sov
cc mark advmod advmod det nsubj advcl compound:prt aux,subordinate_clause,sv
case det obl cc det nsubj conj compound:prt aux,prepositional_phrase,osv
cc obj conj,unknown_chunk,v
case det obl mark root obj det nsubj,prepositional_phrase,ops
case amod nmod cc conj parataxis cop attr,prepositional_phrase,v
cc conj nsubj parataxis,unknown_chunk,vs
case det obl nsubj parataxis obl,prepositional_phrase,vso
case obl det obl X X X X,prepositional_phrase,v
advmod root nsubj acomp obl det pobj nsubj obj advmod,adverbial_clause,pso
acl:relcl xcomp xcomp,infinitive_clause,v
cc conj cc conj det compound compound obj acl:relcl cop acl:relcl obl amod obj,noun_phrase,v
cc conj obl det pobj X X,noun_phrase,v
cc mark advmod mark nsubj obl det pobj advcl advmod root nsubj,subordinate_clause,sop
case obj mark nsubj det nsubj advmod acl xcomp nsubj advmod,prepositional_phrase,osv
ccomp X,complement_clause,unknown
root punct nsubj xcomp,infinitive_clause,ps
case det obl punct conj det nsubj det obj advmod obj nmod:poss,prepositional_phrase,ovs
case det obl case nmod cc conj punct obj nsubj advmod,prepositional_phrase,ovs
ccomp case amod obl,prepositional_phrase,v
punct mark nsubj aux advmod advcl,subordinate_clause,sv
punct nsubj conj advmod compound:prt xcomp,adverbial_clause,s
advmod nsubj aux,adverbial_clause,sv
case advmod amod pobj advcl nsubj root advmod advmod xcomp obj,prepositional_phrase,spo
cc conj case det obl,prepositional_phrase,v
cc case det obl X,prepositional_phrase,unknown
mark det nsubj root neg aux obl amod pobj advcl,subordinate_clause,spo
conj aux obl amod pobj nmod:poss nmod,noun_phrase,v
cc conj det amod pobj obj det nsubj amod xcomp,noun_phrase,osv
conj cc det amod obj,noun_phrase,sv
relcl nsubj,unknown_chunk,s
relcl case xcomp obl det pobj obl det amod pobj iobj nsubj xcomp,prepositional_phrase,osv
conj det amod obj nmod det amod pobj,noun_phrase,v
cc conj advmod xcomp xcomp obj det amod nsubj xcomp,adverbial_clause,ovs
ccomp X X X,complement_clause,v
case det nmod obl advmod root nsubj det obj,prepositional_phrase,ops
cc conj case obl X,prepositional_phrase,v
cc det nsubj aux det amod obj root aux,noun_phrase,sop
cc conj punct cc det nsubj conj det obj,noun_phrase,sv
case det obl,prepositional_phrase,v
cc nsubj root,main_clause,sp
case advmod punct mark nsubj advmod obj aux,prepositional_phrase,sov
mark xcomp case amod obl case,prepositional_phrase,v
cc det nsubj root,noun_phrase,sp
case obl cc conj obj obl pobj,prepositional_phrase,v
cc conj obj obj advmod nsubj,adverbial_clause,ovs
ccomp X,complement_clause,v
cc nsubj root obj iobj det amod obj,noun_phrase,spo
mark nsubj poss obj advcl,subordinate_clause,sv
cc mark nsubj ccomp attr appos advmod,subordinate_clause,sv
conj nsubj amod obj X X,noun_phrase,svo
advmod advmod obl case root advmod,prepositional_phrase,p
ccomp det nsubj advmod advmod,adverbial_clause,s
mark nsubj nmod:poss obj,subordinate_clause,svo
ccomp cc,complement_clause,v
mark nsubj obl aux,subordinate_clause,sov
ccomp obl det nmod:poss amod pobj,noun_phrase,v
mark nsubj advmod advmod advmod obl aux obj,subordinate_clause,sov
ccomp X X,complement_clause,v
cc advmod,adverbial_clause,v
mark nsubj obj advmod advcl xcomp,subordinate_clause,sov
case nmod:poss obl punct root nsubj,prepositional_phrase,ops
case det obl case nmod:poss obl X,prepositional_phrase,unknown
cc nsubj root mark nsubj obj neg advmod aux,subordinate_clause,spo
ccomp obj advmod nsubj,adverbial_clause,ovs
ccomp,complement_clause,v
voc voc punct root nsubj,main_clause,ps
punct nsubj,unknown_chunk,vs
ccomp iobj obj,complement_clause,v
punct advmod advcl nsubj det obj,subordinate_clause,sv
case nmod obl ccomp nsubj obj xcomp,prepositional_phrase,osv
punct advmod nsubj ccomp det amod attr,adverbial_clause,sv
case det nmod punct,prepositional_phrase,v
cc conj xcomp,infinitive_clause,v
case det obl case nmod cc case nmod cc case det amod nmod det nsubj,prepositional_phrase,ovs
acl:relcl punct,unknown_chunk,v
cc conj advmod obj det obj xcomp,adverbial_clause,v
case det obl cc case det amod case det obl,prepositional_phrase,unknown
advmod nsubj root,adverbial_clause,sp
case det det amod obl case det nmod mark nsubj advcl advmod advmod advmod,prepositional_phrase,os
mark det advmod amod nsubj advmod,subordinate_clause,vs
ccomp nsubj,complement_clause,s
conj advmod advmod det obj xcomp X X,adverbial_clause,v
advmod aux advcl det obj punct advmod root nsubj advmod acomp,subordinate_clause,ops
cc conj obj advmod acomp,adverbial_clause,v
punct cc nsubj conj iobj obl nmod,unknown_chunk,svo
vocative punct root nsubj advmod advmod xcomp,adverbial_clause,ps
ccomp nsubj ccomp punct advmod,adverbial_clause,sv
conj nsubj obj iobj advmod xcomp,adverbial_clause,sov
cc root expl attr ref nsubj acl obj det attr cop,noun_phrase,pso
punct mark advcl nsubj obj,subordinate_clause,sv
case det obl xcomp,prepositional_phrase,v
punct cc conj expl attr advmod,adverbial_clause,v
punct mark advcl nsubj obj advmod xcomp,subordinate_clause,vso
case det obl ref nsubj iobj acl:relcl,prepositional_phrase,osv
case obl root nsubj,prepositional_phrase,ops
mark nsubj iobj obj neg xcomp,subordinate_clause,so
ccomp advmod,adverbial_clause,v
conj nsubj obj advmod xcomp X X X,adverbial_clause,sov
advcl obj advcl,subordinate_clause,v
punct nsubj root det attr appos,noun_phrase,sp
case det obl cc det amod attr cc det amod amod,prepositional_phrase,v
conj ref advmod acl xcomp,adverbial_clause,v
case det obl,prepositional_phrase,unknown
advmod iobj root nsubj nsubj,adverbial_clause,ops
ccomp iobj neg conj xcomp,infinitive_clause,v
cc obl pobj mark obl amod pobj cc conj pobj advcl nsubj neg xcomp xcomp X,subordinate_clause,osv
voc root nsubj advcl nsubj advmod advmod,subordinate_clause,ps
ccomp advmod advcl nsubj obj iobj xcomp nsubj advcl aux advmod advmod obj advmod xcomp X X X,subordinate_clause,sov
advmod root nsubj advmod,adverbial_clause,ps
cc mark advmod mark nsubj det amod attr,subordinate_clause,sv
case det nmod conj,prepositional_phrase,v
cc advmod nsubj obl root xcomp aux obl,adverbial_clause,sop
cc det nsubj,noun_phrase,vs
conj obj,unknown_chunk,v
case det obl,prepositional_phrase,v
cc advmod obl fixed det obl cc obj case xcomp,prepositional_phrase,v
case det obl advmod appos obj,prepositional_phrase,v
conj obl case amod nmod,prepositional_phrase,v
cc case mark nsubj advmod advmod obj,prepositional_phrase,svo
case obl,prepositional_phrase,v
ccomp X X,complement_clause,v
cc advmod root det nsubj,adverbial_clause,ps
cc conj xcomp cc det conj advmod obl det case,prepositional_phrase,unknown
cc det nsubj root det attr obl amod obl,noun_phrase,spo
cc conj,unknown_chunk,v
conj mark det nsubj cc det conj case det obl det nmod:gen,prepositional_phrase,sv
ccomp xcomp,infinitive_clause,v
cc conj advmod nsubj xcomp advmod nsubj advmod,adverbial_clause,vs
conj mark nsubj advmod,subordinate_clause,sv
ccomp xcomp,infinitive_clause,v
cc obl case advmod xcomp root nsubj obl,prepositional_phrase,ops
case punct mark nsubj advmod advcl,prepositional_phrase,sv
mark nsubj det amod obj xcomp,subordinate_clause,sov
ccomp obl det,noun_phrase,v
case,prepositional_phrase,unknown
nsubj root det attr advmod nsubj acomp,adverbial_clause,sp
conj,unknown_chunk,v
case advmod amod obl cc case amod obl root det nsubj amod,prepositional_phrase,ops
cc conj nsubj case det obl case obl acl:relcl punct,prepositional_phrase,so
cc advmod det compound nsubj root,adverbial_clause,sp
mark det nsubj obl det,subordinate_clause,so
case xcomp,prepositional_phrase,v
ccomp cc det nsubj,noun_phrase,vs
conj cc,unknown_chunk,v
conj advmod det nsubj,adverbial_clause,vs
conj advmod advmod nsubj ref obj,adverbial_clause,vso
conj xcomp det obj,noun_phrase,v
cc conj obj advmod,adverbial_clause,v
cc conj obj,unknown_chunk,v
cc advmod nsubj obj advmod acomp aux root,adverbial_clause,sop
case det obl case det nmod,prepositional_phrase,unknown
cc mark nsubj obj aux advcl,subordinate_clause,sov
punct root,main_clause,p
case det obl advmod nsubj acl cc nsubj aux,prepositional_phrase,osv
case obl acl det nmod,prepositional_phrase,v
cc mark nsubj advcl,subordinate_clause,sv
punct advmod root nsubj obj xcomp,adverbial_clause,pso
cc aux conj cc conj xcomp,infinitive_clause,v
mark xcomp,subordinate_clause,unknown
cc det nsubj punct nsubj obj mark obj acl,subordinate_clause,sov
mark mark nsubj det obj acomp,subordinate_clause,sov
ccomp punct root obj,complement_clause,p
mark nsubj obl pobj advcl,subordinate_clause,sov
nsubj root advmod xcomp advmod,adverbial_clause,sp
cc conj advmod obj nmod:poss,adverbial_clause,v
punct cc nsubj,unknown_chunk,vs
conj obj advmod xcomp,adverbial_clause,v
cc conj case obl,prepositional_phrase,unknown
cc advmod root nsubj obj aux xcomp,adverbial_clause,pso
cc conj,unknown_chunk,v
root punct conj punct nsubj,main_clause,ps
conj obj xcomp,infinitive_clause,v
punct advcl det nsubj,subordinate_clause,vs
ccomp advmod advmod acomp obl pobj xcomp,adverbial_clause,v
mark nsubj advmod advcl xcomp,subordinate_clause,sv
punct advcl nsubj advmod advmod advmod xcomp,subordinate_clause,sv
ccomp obl advmod amod pobj,adverbial_clause,v
mark nsubj iob advcl xcomp obl det pobj,subordinate_clause,svo
advmod root nsubj acomp,adverbial_clause,ps
case obl advmod advmod advmod advmod,prepositional_phrase,v
case pobj pobj punct mark nsubj nsubj acl obj advmod amod obj,prepositional_phrase,osv
case det obl xcomp advcl nsubj case pobj conj cc nsubj conj obj advmod neg compound:prt advmod obl det pobj,prepositional_phrase,osv
mark nsubj advcl det amod obj,subordinate_clause,svo
acl:relcl obl pobj obj acl X X,unknown_chunk,v
mark det nsubj aux det obj advcl mark root nsubj,subordinate_clause,sop
cc conj advmod cc case obl,prepositional_phrase,v
mark conj case det obj,prepositional_phrase,v
case nmod:poss obl X X,prepositional_phrase,v
cc mark nsubj advcl det obj obj nsubj advmod acomp acl,subordinate_clause,sov
punct root nsubj advmod xcomp,adverbial_clause,ps
mark nsubj obj xcomp,subordinate_clause,sov
ccomp cc conj advmod xcomp,adverbial_clause,v
mark nsubj advmod advmod det obl advcl,subordinate_clause,sov
cc nsubj root det amod obj obl det pobj,noun_phrase,spo
cc mark nsubj xcomp,subordinate_clause,vs
conj advmod,adverbial_clause,v
conj nsubj advmod acomp X X,adverbial_clause,sv
voc compound voc,noun_phrase,v
punct nsubj root neg,main_clause,sp
mark nsubj advmod xcomp,subordinate_clause,sv
ccomp mark xcomp,subordinate_clause,v
case det obl ref iobj nsubj aux acl,prepositional_phrase,osv
advmod root nsubj,adverbial_clause,ps
case obl,prepositional_phrase,unknown
nsubj root obj det obj,noun_phrase,spo
relcl obl obj,unknown_chunk,v
cc conj cop attr nsubj iobj,unknown_chunk,vso
ccomp xcomp mark amod obj,subordinate_clause,unknown
voc punct root nsubj,main_clause,ps
punct ccomp iobj obj,complement_clause,v
cc obj,unknown_chunk,v
nsubj ccomp punct root det nsubj,noun_phrase,sp
punct advmod conj advmod amod obj xcomp,adverbial_clause,v
vocative punct root nsubj,main_clause,ps
punct nsubj,unknown_chunk,vs
ccomp xcomp advmod,adverbial_clause,v
mark advmod amod obj,subordinate_clause,v
mark nsubj neg,subordinate_clause,vs
ccomp mark nsubj ccomp aux xcomp obl amod pobj,subordinate_clause,svo
punct mark nsubj nsubj advcl,subordinate_clause,sv
punct nsubj,unknown_chunk,vs
conj det obj cc ref advmod obj nsubj det obj conj,adverbial_clause,osv
case det obl,prepositional_phrase,v
punct parataxis det nsubj,noun_phrase,vs
punct nsubj root advmod,adverbial_clause,sp
mark nsubj aux,subordinate_clause,sv
ccomp punct,complement_clause,v
mark det amod obj acl:relcl nsubj case iobj aux acl obj xcomp,prepositional_phrase,osv
punct mark nsubj obj advmod mark nsubj xcomp advcl,subordinate_clause,sov
punct advmod parataxis nsubj advmod,adverbial_clause,vs
mark nsubj xcomp ccomp punct advmod aux parataxis iobj,subordinate_clause,svo
case obl xcomp,prepositional_phrase,v
advmod advmod root nsubj advmod,adverbial_clause,ps
mark nsubj advmod,subordinate_clause,sv
case det obl ccomp,prepositional_phrase,v
cc mark det nsubj,subordinate_clause,vs
ccomp amod obj xcomp det obj cc det nsubj conj obj xcomp case det obl,prepositional_phrase,osv
case det obl X,prepositional_phrase,unknown
cc det nsubj root xcomp,noun_phrase,sp
cc conj,unknown_chunk,v
case det obl cc conj,prepositional_phrase,v
vocative det nsubj root advmod obl advmod,adverbial_clause,spo
mark mark xcomp case obl X,prepositional_phrase,v
cc nsubj conj advmod,adverbial_clause,sv
cc conj poss obj,unknown_chunk,v
punct mark obj nsubj obj acl neg root det amod obj ref nsubj acl xcomp,subordinate_clause,osp
det appos nsubj root iobj xcom det obj,noun_phrase,spo
cc det nmod obj,noun_phrase,v
cc advcl nsubj advmod acomp advcl punct obl nmod obl,subordinate_clause,svo
punct cc root obl det obl,noun_phrase,p
cc conj det obj,noun_phrase,v
punct nsubj acl:relcl advmod acomp,adverbial_clause,sv
cc conj obj xcomp,infinitive_clause,v
cc mark nsubj case det amod obl advcl advmod acomp punct root nsubj advmod,prepositional_phrase,sop
case det obl cc conj advmod,prepositional_phrase,v
punct nsubj appos,unknown_chunk,vs
cc det conj nsubj advmod acl:relcl acl:relcl,adverbial_clause,sv
case det obl,prepositional_phrase,unknown
vocative punct root det nsubj appos,noun_phrase,ps
case det obl appos,prepositional_phrase,v
punct mark det nsubj advmod acomp advcl acomp,subordinate_clause,sv
mark nsubj advmod ccomp xcomp punct advmod parataxis nsubj advmod,subordinate_clause,sv
mark nsubj det amod obj,subordinate_clause,vso
ccomp mark det nsubj,subordinate_clause,vs
ccomp det obj punct nsubj obj advcl,subordinate_clause,osv
punct nsubj case det obl parataxis,prepositional_phrase,sov
nsubj ccomp obj advmod advmod,adverbial_clause,svo
punct root det nsubj,noun_phrase,ps
punct advcl det obl,subordinate_clause,v
cc nsubj obj advmod conj xcomp,adverbial_clause,so
advmod mark nsubj det iobj det obj root advmod nsubj,subordinate_clause,sop
conj advmod case obl case det obl,prepositional_phrase,unknown
cc mark nsubj obj aux advcl,subordinate_clause,sov
case det obl punct advmod root det nsubj,prepositional_phrase,ops
voc parataxis conj advmod nsubj parataxis det attr,adverbial_clause,sv
cc det conj aux case det obl advmod parataxis nsubj det amod obj voc root det nsubj obj nsubj parataxis obj neg xcomp,prepositional_phrase,osp
case obl,prepositional_phrase,v
mark det aux obj advcl obj nsubj,subordinate_clause,vos
acl:relcl case obl,prepositional_phrase,v
cc case obl,prepositional_phrase,v
case det obl X X X X X X X,prepositional_phrase,v
nsubj root det attr advmod xcomp,adverbial_clause,sp
mark advmod nsubj obj advcl,subordinate_clause,sov
punct advmod root nsubj det amod obj xcomp,adverbial_clause,pso
mark nsubj aux advcl,subordinate_clause,sv
punct cc conj,unknown_chunk,v
advmod root nsubj obj punct,adverbial_clause,pso
cc nsubj conj,unknown_chunk,sv
cc conj advmod obl det pobj cc conj mark det amod obj ref nsubj obj,subordinate_clause,ovs
cc obj cc advmod obj punct,adverbial_clause,v
mark nsubj advmod advcl punct advmod case obl xcomp,prepositional_phrase,sov
conj punct nsubj,unknown_chunk,vs
conj advmod advmod obj,adverbial_clause,v
case det amod obl punct mark nsubj aux obj,prepositional_phrase,osv
cc conj case det nmod,prepositional_phrase,unknown
advmod root nsubj advmod advmod mark advcl aux xcomp,subordinate_clause,ps
cc advmod det nsubj advmod,adverbial_clause,vs
conj cc obj,unknown_chunk,v
cc conj,unknown_chunk,v
cc conj cc conj det,noun_phrase,v
conj X,unknown_chunk,v
cc advmod root det nsubj obl det pobj obl,adverbial_clause,pso
case det pobj cc advmod nsubj conj advmod obj,prepositional_phrase,osv
cc obj punct advmod conj nsubj obj nsubj,adverbial_clause,ovs
ccomp nummod,complement_clause,v
cc conj,unknown_chunk,v
punct acl:relcl det amod attr cop,noun_phrase,v
cc nsubj conj advmod obl pobj advcl,subordinate_clause,sov
cc advmod root nsubj det obj case det obl nsubj iobj obj relcl X,prepositional_phrase,pso
cc mark nsubj aux advcl,subordinate_clause,sv
punct mark advcl nsubj det obj,subordinate_clause,vso
case det obl,prepositional_phrase,v
punct advmod root nsubj det amod attr,adverbial_clause,ps
mark nsubj advmod advmod xcomp acl,subordinate_clause,sv
